id,premium,name,department,has_test,response_letter_required,area,salary,type,address,response_url,sort_point_distance,published_at,created_at,archived,apply_alternate_url,insider_interview,url,adv_response_url,alternate_url,relations,employer,name,url,alternate_url,logo_urls,90,240,vacancies_url,trusted,snippet,responsibility,contacts,schedule,working_days,working_time_intervals,working_time_modes,accept_temporary
68756077,False,Ведущий аналитик,,False,False,"{'id': '15', 'name': 'Астрахань', 'url': 'https://api.hh.ru/areas/15'}","{'from': 25000, 'to': None, 'currency': 'RUR', 'gross': False}","{'id': 'open', 'name': 'Открытая'}",,,,2022-09-12T12:56:37+0300,2022-09-12T12:56:37+0300,False,https://hh.ru/applicant/vacancy_response?vacancyId=68756077,,https://api.hh.ru/vacancies/68756077?host=hh.ru,https://api.hh.ru/vacancies/68756077/adv_response?host=hh.ru,https://hh.ru/vacancy/68756077,[],"{'id': '5496993', 'name': 'Филиал ФГБУ ИАЦ Судебного департамента в Астраханской области', 'url': 'https://api.hh.ru/employers/5496993', 'alternate_url': 'https://hh.ru/employer/5496993', 'logo_urls': None, 'vacancies_url': 'https://api.hh.ru/vacancies?employer_id=5496993', 'trusted': True}",Ведущий аналитик,https://api.hh.ru/vacancies/68756077?host=hh.ru,https://hh.ru/vacancy/68756077,,,,,,"{'requirement': 'Высшее образование техническое. Стаж работы не менее 2 лет.', 'responsibility': 'Регистрация заявок, отчеты по поступившим заявкам. Ведение, сбор, обобщение и анализ информации из объектов автоматизации по проблемам возникающим с программно...'}",,,"{'id': 'fullDay', 'name': 'Полный день'}",[],[],[],False
69586791,False,Торговый представитель,,False,False,"{'id': '15', 'name': 'Астрахань', 'url': 'https://api.hh.ru/areas/15'}","{'from': 25000, 'to': 45000, 'currency': 'RUR', 'gross': True}","{'id': 'open', 'name': 'Открытая'}","{'city': 'Волгоград', 'street': 'улица Пархоменко', 'building': '47', 'description': None, 'lat': 48.722392, 'lng': 44.524575, 'raw': 'Волгоград, улица Пархоменко, 47', 'metro': None, 'metro_stations': [], 'id': '5122474'}",,,2022-09-07T16:24:54+0300,2022-09-07T16:24:54+0300,False,https://hh.ru/applicant/vacancy_response?vacancyId=69586791,,https://api.hh.ru/vacancies/69586791?host=hh.ru,https://api.hh.ru/vacancies/69586791/adv_response?host=hh.ru,https://hh.ru/vacancy/69586791,[],"{'id': '3730635', 'name': 'Волгапроф', 'url': 'https://api.hh.ru/employers/3730635', 'alternate_url': 'https://hh.ru/employer/3730635', 'logo_urls': None, 'vacancies_url': 'https://api.hh.ru/vacancies?employer_id=3730635', 'trusted': True}",Торговый представитель,https://api.hh.ru/vacancies/69586791?host=hh.ru,https://hh.ru/vacancy/69586791,,,,,,"{'requirement': 'Высокий уровень коммуникабельности, самодисциплины, настойчивости, результативности. - Опыт работы торговым представителем от 2-х лет. - Опыт работы с салонами красоты будет...', 'responsibility': 'Продуктивное развитие существующей клиентской базы. - Привлечение новых клиентов. - Создание долгосрочных эффективных отношений с клиентами. - Своевременное оформление документации и отслеживание дебиторской...'}",,,"{'id': 'fullDay', 'name': 'Полный день'}",[],[],[],False
69523495,False,Торговый представитель,,False,False,"{'id': '15', 'name': 'Астрахань', 'url': 'https://api.hh.ru/areas/15'}","{'from': 35000, 'to': None, 'currency': 'RUR', 'gross': True}","{'id': 'open', 'name': 'Открытая'}",,,,2022-09-06T11:28:46+0300,2022-09-06T11:28:46+0300,False,https://hh.ru/applicant/vacancy_response?vacancyId=69523495,,https://api.hh.ru/vacancies/69523495?host=hh.ru,https://api.hh.ru/vacancies/69523495/adv_response?host=hh.ru,https://hh.ru/vacancy/69523495,[],"{'id': '3413628', 'name': 'Инструмент ОПТ', 'url': 'https://api.hh.ru/employers/3413628', 'alternate_url': 'https://hh.ru/employer/3413628', 'logo_urls': {'90': 'https://hhcdn.ru/employer-logo/2555109.jpeg', '240': 'https://hhcdn.ru/employer-logo/2555110.jpeg', 'original': 'https://hhcdn.ru/employer-logo-original/528408.jpg'}, 'vacancies_url': 'https://api.hh.ru/vacancies?employer_id=3413628', 'trusted': True}",Торговый представитель,https://api.hh.ru/vacancies/69523495?host=hh.ru,https://hh.ru/vacancy/69523495,,,,,,"{'requirement': 'Высшее или среднее специальное образование. Опыт работы в продажах стройматериалов приветствуется. Рассматриваем также кандидатов без опыта работы, обучение бесплатно. ', 'responsibility': 'Работа по существующей клиентской базе. Поиск новых клиентов, полное сопровождение сделки. Работа с дебиторской задолженностью, отчетность. Анализ рынка, отчеты.'}",,,"{'id': 'fullDay', 'name': 'Полный день'}",[],[],[],False
69461702,False,Торговый представитель отдела продаж,,False,False,"{'id': '15', 'name': 'Астрахань', 'url': 'https://api.hh.ru/areas/15'}","{'from': 30000, 'to': 150000, 'currency': 'RUR', 'gross': False}","{'id': 'open', 'name': 'Открытая'}","{'city': 'Астрахань', 'street': 'улица Савушкина', 'building': '6к6', 'description': None, 'lat': 46.372181, 'lng': 48.04748, 'raw': 'Астрахань, улица Савушкина, 6к6', 'metro': None, 'metro_stations': [], 'id': '11660283'}",,,2022-09-05T07:58:30+0300,2022-09-05T07:58:30+0300,False,https://hh.ru/applicant/vacancy_response?vacancyId=69461702,,https://api.hh.ru/vacancies/69461702?host=hh.ru,https://api.hh.ru/vacancies/69461702/adv_response?host=hh.ru,https://hh.ru/vacancy/69461702,[],"{'id': '2537152', 'name': 'СБ логистик', 'url': 'https://api.hh.ru/employers/2537152', 'alternate_url': 'https://hh.ru/employer/2537152', 'logo_urls': None, 'vacancies_url': 'https://api.hh.ru/vacancies?employer_id=2537152', 'trusted': True}",Торговый представитель отдела продаж,https://api.hh.ru/vacancies/69461702?host=hh.ru,https://hh.ru/vacancy/69461702,,,,,,"{'requirement': 'Готовность к разъездной работе. Опыт работы от 1 года. Желание добиваться результатов и расти вместе с компанией. Грамотная речь, умение...', 'responsibility': 'Работа в г. Астрахань и Астраханской области. Реализация политики продаж компании на заданной территории, работа с активной клиентской базой, поиск...'}",,,"{'id': 'fullDay', 'name': 'Полный день'}",[],[],[],False
69480595,False,Менеджер по персоналу,,False,False,"{'id': '15', 'name': 'Астрахань', 'url': 'https://api.hh.ru/areas/15'}","{'from': 35000, 'to': None, 'currency': 'RUR', 'gross': True}","{'id': 'open', 'name': 'Открытая'}","{'city': 'Астрахань', 'street': 'Звёздная улица', 'building': '17', 'description': None, 'lat': 46.329123, 'lng': 48.055673, 'raw': 'Астрахань, Звёздная улица, 17', 'metro': None, 'metro_stations': [], 'id': '2605846'}",,,2022-09-05T12:23:21+0300,2022-09-05T12:23:21+0300,False,https://hh.ru/applicant/vacancy_response?vacancyId=69480595,,https://api.hh.ru/vacancies/69480595?host=hh.ru,https://api.hh.ru/vacancies/69480595/adv_response?host=hh.ru,https://hh.ru/vacancy/69480595,[],"{'id': '3530', 'name': 'СДЭК', 'url': 'https://api.hh.ru/employers/3530', 'alternate_url': 'https://hh.ru/employer/3530', 'logo_urls': {'90': 'https://hhcdn.ru/employer-logo/5393076.png', '240': 'https://hhcdn.ru/employer-logo/5393077.png', 'original': 'https://hhcdn.ru/employer-logo-original/964764.png'}, 'vacancies_url': 'https://api.hh.ru/vacancies?employer_id=3530', 'trusted': True}",Менеджер по персоналу,https://api.hh.ru/vacancies/69480595?host=hh.ru,https://hh.ru/vacancy/69480595,,,,,,"{'requirement': 'Опыт работы в сфере HR не менее 2-х лет. Знание и применение технологий и методик подбора персонала. ', 'responsibility': '...связи с наставником и руководителем. Участие в HR-проектах компании. Организация ярких и запоминающихся корпоративных мероприятий. <highlighttext>Аналитика</highlighttext> по процессам работы.'}",,,"{'id': 'fullDay', 'name': 'Полный день'}",[],[],[],False
